{"action":"publish","action_hash":"bef8888ad4b54b5afdc9739d5365c1cc5eb2d078a9b3f3d677d09522fdd3d06e","action_id":"pca_bef8888ad4b54b5a","action_revision":1,"action_status":"approved_for_handoff","action_version":"publication-action/v1","approval":{"action_hash":"bef8888ad4b54b5afdc9739d5365c1cc5eb2d078a9b3f3d677d09522fdd3d06e","approval_reference":"approval_wave2_synthetic_001","approved":true,"approved_at":"2026-08-05T00:05:00.000Z","reviewed_action_sha256":"715fa84d4863923bbf323e3e4e5973ec13d36b5773ffe0de2aaa8d2ff95dfb70","reviewed_draft_sha256":"7e493c1cd6a26ccd5ddc992b97c4dcf8b968ef9eed784da21b301571c17c431a","role":"owner"},"asset_reviews":[{"metadata_inspection":"not_applicable_synthetic","path":"assets/synthetic-toyota-vios-case.svg","sha256":"9af913aa6d16e6c2ecb0c6fd3df4bed99192b8f59cc7618aab4f698b1f28b84a","status":"approved"}],"authorization":{"approval_timestamp":"2026-08-05T00:05:00.000Z","authorization_verified":true,"evidence_reference":"evidence_wave2_synthetic_001","owner_approved":true,"publication_consent_verified":true,"reviewer_role":"owner","revoked":false},"candidate_hash":"6027337da976411cab4f5f962db98b832174b492cee1472db074be581a12f1e6","candidate_id":"cpc_6027337da976411c","candidate_revision":1,"consent":{"consent_record_sha256":"57a3054161e15e41a1025e496afa8e9d926de4d6115e7703cf56740fc4aaddea","consent_reference":"consent_wave2_synthetic_001","expires_at":null,"granted_at":"2026-08-05T00:00:00.000Z","public_content_consent":true,"purpose":"public_website_case","scope":"carkey.com.tw","status":"active","withdrawal_requested":false},"contract_version":"1.0.0","draft_sha256":"7e493c1cd6a26ccd5ddc992b97c4dcf8b968ef9eed784da21b301571c17c431a","expected_carkey_base_sha":"b397cf263eea5749d299d2a8d02d14654efb409e","expected_current_public_content_hash":null,"expected_state":"unpublished","locale":"zh-TW","package_hash":"09a287a7c87e3d9dfc936d184c54589b2906f4583c5ab3229e32487f3c2228e7","previous_action_id":null,"prior_publication":null,"proposed_public_content_hash":"7e493c1cd6a26ccd5ddc992b97c4dcf8b968ef9eed784da21b301571c17c431a","public_record_id":"pcr_6027337da976411c","requested_publication":{"canonical_continuity_required":false,"preserve_publication_history":true,"proposed_slug":"article-toyota-vios-2019-changhua-akl-wave1","publication_date":"2026-08-05","reason_code":"initial_publication","redirect_intent":"none","replacement_url":null,"requested_resolution":"publish","sitemap_intent":"ensure_present"},"source_repository_sha":"aff300736f831c927801f661816eb805ca5cea43","source_system":"casepilot-automotive","synthetic":true,"target_system":"carkey.com.tw"}
